NAME,ADDRESS,ZIPCODE,CITY,STATE,COUNTRY,result_num,osm_id,display_na,category,type,lat,long
Centersquare,8180 Green Meadows Dr N,43035,North Lewis Center,Ohio,USA,0,590556936,"Toyota Material Handling Ohio, 8399, Green Meadows Drive North, Orange Township, Delaware County, Ohio, 43035, United States",building,industrial,40.16017955,-83.01281192
Microsoft,8855 Grand Avenue,50266,Des Moines,Iowa,USA,0,702508087,"Grand Avenue, Downtown, Des Moines, Polk County, Iowa, 50309, United States",highway,secondary,41.5869896,-93.6289897
NEXCESS.NET L.L.C.,22015 W. Outer Drive,48124,Dearborn,Michigan,USA,0,1110629759,"22015, West Outer Drive, Southwestern Outer Drive, Dearborn, Allen Park, Wayne County, Michigan, 48124, United States",place,house,42.28515909,-83.23391342
CyrusOne Data Centers,Faxon Rd,60545,Yorkville,Illinois,USA,0,196949963,"Faxon Road, Yorkville, Bristol Township, Kendall County, Illinois, 60560, United States",highway,unclassified,41.674509,-88.4756466
"Cogent Communications, Inc.",332 W. Broadway,40202,Louisville,Kentucky,USA,0,3380192607,"Aspire Cafe & Juice Bar, 332, West Broadway, Louisville, Jefferson County, Kentucky, 40202, United States",amenity,cafe,38.24566,-85.7579732
Westelcom,24 Margaret Street,12901,Plattsburgh,New York,USA,0,8796913923,"24, Margaret Street, City of Plattsburgh, Clinton County, New York, 12901, United States",place,house,44.6964195,-73.4532888
Advance2000,1140 Wehrle Drive,14221,Williamsville,New York,USA,0,480220478,"Wehrle Drive, Village of Williamsville, Town of Amherst, Erie County, New York, 14221, United States",highway,tertiary,42.956071,-78.738011
Lumen,122 Helena Ave,92101,Santa Barbara,California,USA,0,6070268256,"122, Helena Avenue, Funk Zone, Santa Barbara, Santa Barbara County, California, 93101, United States",place,house,34.414414,-119.690154
"Nexus Management, Inc.",4 Industrial Parkway,4011,Brunswick,Maine,USA,0,432161573,"4, Industrial Parkway, Brunswick Industrial Park, Brunswick, Cumberland County, Maine, 04011, United States",building,commercial,43.9079987,-69.99678834
Lumen,14452 Franklin Avenue,92780,Tustin,California,USA,0,441502816,"Lumen Technologies, 14452, Franklin Avenue, Browning Station, Tustin, Orange County, California, 92780, United States",building,data_center,33.7167573,-117.8057759
Pearl Technology,606 NE Jefferson Street,61603,Peoria,Illinois,USA,0,21974463,"Jefferson Street, Bartonville, Peoria County, Illinois, 61607, United States",highway,residential,40.6537217,-89.6532953
H5 Data Centers,1125 Energy Park Dr,55108,Saint Paul,Minnesota,USA,0,1027655400,"1125, Energy Park Drive, Como Park, Saint Paul, Ramsey County, Minnesota, 55108, United States",place,house,44.97061381,-93.14723498
STACK INFRASTRUCTURE,1200 Memorex Dr,95050,Santa Clara,California,USA,0,8963025,"1200, Memorex Drive, Santa Clara, Santa Clara County, California, 95050, United States",place,house,37.362544,-121.950062
QTS Data Centers,1225 Beech Rd SW,43054,New Albany,Ohio,USA,0,30169114,"1225, Beech Road Southwest, Beech, New Albany, Jersey Township, Licking County, Ohio, 43054, United States",place,house,40.06910313,-82.75410858
Iron Mountain Data Centers,615 North 48th Street,85008,Phoenix,Arizona,USA,0,136759061,"615, North 48th Street, Tovrea, Phoenix, Maricopa County, Arizona, 85008, United States",building,yes,33.45449175,-111.9761812
Firstlight Fiber,14 Resilient Circle,4011,Brunswick,Maine,USA,0,667796922,"Oxford Networks, 14, Resilient Circle, Brunswick, Cumberland County, Maine, 04011, United States",building,yes,43.89518095,-69.922964
NOCIX,1530 Swift St.,64116,Kansas City,Missouri,USA,0,195837791,"NOCIX, 1530, Swift Street, North Kansas City, Clay County, Missouri, 64116, United States",building,yes,39.1359972,-94.57791753
Awecomm Technologies,"165 Kirts Blvd., #400",48084,Troy,Michigan,USA,0,1076917725,"Straightline, 165, Kirts Boulevard, Troy, Oakland County, Michigan, 48084, United States",building,office,42.5556241,-83.14971285
Evocative Data Centers,1 Enterprise Ave N,7094,Secaucus,New Jersey,USA,0,605481999,"1, Enterprise Avenue North, Secaucus, Hudson County, New Jersey, 07094, United States",place,house,40.78878,-74.066502
Centersquare,21561 Beaumeade Circle,20147,Ashburn,Virginia,USA,0,300163074,"Evoque Ashburn WDC1, 21561, Beaumeade Circle, Ashburn, Loudoun County, Virginia, 20147, United States",building,data_center,39.0221022,-77.45366304
Windstream,112 6th St,37620,Bristol,Tennessee,USA,0,19625402,"6th Street, Edgemont, Bristol, Sullivan County, East Tennessee, Tennessee, 37620, United States",highway,residential,36.5776298,-82.1877714
Deft,43830 Devin Shafron Dr,20147,Ashburn,Virginia,USA,0,300969619,"Digital Realty Building F, 43830, Devin Shafron Drive, Loudoun Station, Ashburn, Loudoun County, Virginia, 20147, United States",building,data_center,39.00433355,-77.48434989
CISP,3035 Moffat,43615,Toledo,Ohio,USA,0,8782734,"Moffat Road, Toledo, Lucas County, Ohio, 43615, United States",highway,residential,41.6680307,-83.6925024
Meta,5400 Prosperity Dr NW,35810,Huntsville,Alabama,USA,0,7822040,"Prosperity Drive Northwest, North Huntsville Industrial Park, Huntsville, Madison County, Alabama, 35773, United States",highway,unclassified,34.840998,-86.638486
US Secure Hosting Center (USSHC),24253 US Highway 151,52310,Monticello,Iowa,USA,0,15941794,"South Main Street, Monticello, Jones County, Iowa, 52310, United States",highway,tertiary,42.210148,-91.193661
Richweb,7474 Lee Davis Road,23111,Mechanicsville,Virginia,USA,0,11476599490,"7474, Lee-Davis Road, Cypresstree, Mechanicsville, Hanover County, Virginia, 23111, United States",place,house,37.6138052,-77.3390753
Digital Fortress,360 E 22nd St.,60148,Lombard,Illinois,USA,0,186592505,"360, East 22nd Street, Highland Hills, Lombard, DuPage County, Illinois, 60148, United States",place,house,41.84581133,-88.00720071
Performive,55 Marietta,30303,Atlanta,Georgia,USA,0,262879648,"55 Marietta, 40, Forsyth Street Northwest, Five Points, Atlanta, Fulton County, Georgia, 30303, United States",building,yes,33.7558937,-84.39107084
Quest Technology Management,4235 Forcum Ave,95652,Sacramento,California,USA,0,1026612475,"4235, Forcum Avenue, Sacramento County, California, 95652, United States",place,house,38.6469301,-121.4059037
SolidSpace,450 W. Hanes Mill Road,27105,Winston-Salem,North Carolina,USA,0,339817688,"450, West Hanes Mill Road, Winston-Salem, Forsyth County, North Carolina, 27105, United States",building,yes,36.1812233,-80.28224666
"Charlotte Colocation Center, LLC",5821 Fairview Road,28209,Charlotte,North Carolina,USA,0,648860793,"5821, Fairview Road, Fairmeadows, Charlotte, Mecklenburg County, North Carolina, 28209, United States",place,house,35.15190285,-80.84281228
Axios Hosting,5000 T-Rex Ave.,33431,Boca Raton,Florida,USA,0,11210251,"5000, T-Rex Avenue, Boca Raton Innovation Campus, Boca Raton, Palm Beach County, Florida, 33431, United States",place,house,26.39321507,-80.10761577
"UnitedLayer, Inc.",7135 S Decatur Blvd,89118,Las Vegas,Nevada,USA,0,172739953,"Switch Las Vegas 7, 7135, South Decatur Boulevard, Enterprise, Clark County, Nevada, 89118, United States",building,yes,36.06011615,-115.2101941
"BitPusher, LLC.",12101 Tukwila International Blvd,98168,Tukwila,Washington,USA,0,337126739,"Intergate Seattle West Building C, 12101, Tukwila International Boulevard, Tukwila, King County, Washington, 98168, United States",building,yes,47.494135,-122.2944103
Digital Realty,1215 Integrity Drive,75081,Richardson,Texas,USA,0,597876719,"Rackspace Richardson DFW3, 1215, Integrity Drive, Richardson, Dallas County, Texas, 75081, United States",building,data_center,32.96483325,-96.7158846
CBTS,123 Pine St,45011,Hamilton,Ohio,USA,0,19064605,"Pine Street, Norwood, Hamilton County, Ohio, 45212, United States",highway,residential,39.16422,-84.447593
Gotspace Data Partners,388 Plain Hill Rd,6360,Norwich,Connecticut,USA,0,17157823,"388, Plain Hill Road, Bean Hill Historic District, Bean Hill, Norwich, Southeastern Connecticut Planning Region, Connecticut, 06360, United States",place,house,41.58897103,-72.10175644
Aligned Data Centers,505 Northwest Avenue,60164,Northlake,Illinois,USA,0,24082896,"505, Northwest Avenue, Northlake, Leyden Township, Cook County, Illinois, 60164, United States",place,house,41.91890967,-87.91923047
NYI (New York Internet Company),999 Frontier Road,8807,Bridgewater,New Jersey,USA,0,618339179,"999, Frontier Road, Bridgewater Township, Somerset County, New Jersey, 08807, United States",building,yes,40.58144235,-74.5738875
Compass Datacenters,6625 New Albany Rd E,43054,New Albany,Ohio,USA,0,188349988,"New Albany Road East, New Albany, Plain Township, Franklin County, Ohio, 43054, United States",highway,tertiary,40.104449,-82.8155344
NacSpace.com,2400 North Stallings Drive,75964,Nacogdoches,Texas,USA,0,142872918,"2400, North Stallings Drive, Nacogdoches, Nacogdoches County, Texas, 75964, United States",place,house,31.652332,-94.674257
Iron Mountain Data Centers,4300 Brighton Blvd,80216,Denver,Colorado,USA,0,7501655206,"Iron Mountain, 4300, Brighton Boulevard, Elyria Swansea, Denver, Colorado, 80216, United States",office,it,39.7773941,-104.9686877
Digital Realty,1201 Comstock Street,95054,Santa Clara,California,USA,0,209073649,"1201 Comstock Street, 1201, Comstock Street, Santa Clara, Santa Clara County, California, 95054, United States",building,data_center,37.37499655,-121.9540769
Midco,4624 28th Ave S,58104,Fargo,North Dakota,USA,0,9636334,"28th Avenue South, Brunsdale, Fargo, Cass County, North Dakota, 58103, United States",highway,residential,46.837537,-96.803434
SoftLayer,4849 Alpha Rd,75244,Dallas,Texas,USA,0,427839308,"4849, Alpha Road, Farmers Branch, Dallas County, Texas, 75244, United States",building,office,32.9338692,-96.82802117
Flexential,5301 NW 33rd Ave,33309,Fort Lauderdale,Florida,USA,0,741629998,"Flexential Fort Lauderdale, 5301, Northwest 33rd Avenue, Fort Lauderdale, Broward County, Florida, 33309, United States",building,yes,26.1900857,-80.19329665
Amazon AWS,44854 Interconnection Plz,20147,Ashburn,Virginia,USA,0,463571875,"Amazon IAD78, 44854, Interconnection Plaza, Ashburn, Loudoun County, Virginia, 20147, United States",building,data_center,39.0263681,-77.44952023
Google,3800 Railport Pkwy,76065,Midlothian,Texas,USA,0,458226548,"Malouf, 3800, Railport Parkway, Midlothian, Ellis County, Texas, 76065, United States",building,warehouse,32.44324265,-97.048805
Digital Realty,44100 Digital Loudoun Plaza,20147,Ashburn,Virginia,USA,0,1020953454,"Digital Loudoun Plaza, Ashburn, Loudoun County, Virginia, United States",landuse,industrial,39.00482755,-77.48527857
"Cogent Communications, Inc.",240 N 5th Street,43215,Columbus,Ohio,USA,0,21415529,"North 5th Street, Weinland Park, Columbus, Franklin County, Ohio, 43201, United States",highway,residential,39.9898591,-82.9981839
Unknown Company,102 South Tejon Street,80903,Colorado Springs,Colorado,USA,0,6716581746,"Freedom Financial Services, 102, South Tejon Street, Colorado Springs, El Paso County, Colorado, 80903, United States",office,financial,38.8322026,-104.8240145
"Global Reach Internet Productions, LLC.",2321 N Loop Dr,50010,Ames,Iowa,USA,0,260815733,"CPMI, 2321, North Loop Drive, Iowa State University Research Park, Ames, Story County, Iowa, 50010, United States",building,yes,42.0020484,-93.63511213
DataBank,100 South commons,15212,Pittsburgh,Pennsylvania,USA,0,10308936036,"OpenArc, 100, South Commons, Allegheny Center, Pittsburgh, Allegheny County, Pennsylvania, 15212, United States",office,it,40.4514458,-80.0046809
Equinix,2222 East Grauwyler Road,75061,Irving,Texas,USA,0,9954342,"2222, East Grauwyler Road, Irving, Dallas County, Texas, 75061, United States",place,house,32.8306365,-96.91235033
Aligned Data Centers,3333 W 9000 S,84088,West Jordan,Utah,USA,0,368893551,"9000 South, West Jordan, Salt Lake County, Utah, 84081, United States",highway,primary,40.5879332,-112.0247756
Amazon AWS,45360 West Severn Way,20166,Sterling,Virginia,USA,0,48242814,"Amazon IAD10, 45360, West Severn Way, Sterling, Loudoun County, Virginia, 20166, United States",building,data_center,39.02193325,-77.43279036
IPXON Networks,50 NE 9th St,33132,Miami,Florida,USA,0,6085499304,"50, Northeast 9th Street, Miami, Miami-Dade County, Florida, 33132, United States",place,house,25.7825762,-80.1927703
DQE Communications,238 Pillow St,16001,Butler,Pennsylvania,USA,0,19322470,"238, Pillow Street, Butler, Butler County, Pennsylvania, 16001, United States",place,house,40.86047505,-79.90664408
Equinix,450 Interstate North Parkway,30339,Atlanta,Georgia,USA,0,284554945,"450, Interstate North Parkway Southeast, Chattahoochee Bluffs, Atlanta, Cobb County, Georgia, 30339, United States",building,office,33.89547465,-84.45351661
Telehouse America,7 Teleport Drive,10311,New York,New York,USA,0,554279575,"7, Teleport Drive, Bloomfield, Staten Island, Richmond County, City of New York, New York, 10311, United States",place,house,40.60576514,-74.17642541
"Cogent Communications, Inc.",324 East Wisconsin Avenue,53202,Milwaukee,Wisconsin,USA,0,53216745,"Wells Building, 324, East Wisconsin Avenue, Historic Financial District, Juneautown, Downtown, Milwaukee, Milwaukee County, Wisconsin, 53202, United States",historic,building,43.0389885,-87.90693794
Lumen,44633 Guilford Drive,20147,Ashburn,Virginia,USA,0,8805359,"44633, Guilford Drive, Ashburn, Loudoun County, Virginia, 20147, United States",place,house,39.02269287,-77.45661548
Infotel Systems,6008 Hermitage Road,23228,Henrico,Virginia,USA,0,708265497,"6008, Hermitage Road, Lakeside, Henrico County, Virginia, 23228, United States",building,yes,37.6129495,-77.47330114
Prime Data Centers,6580 Via del Oro,95119,San Jose,California,USA,0,13617610,"6580, Via Del Oro, San Jose, Santa Clara County, California, 95119, United States",building,yes,37.23542835,-121.7822509
Flexential,425 Duke Dr.,37067,Franklin,Tennessee,USA,0,1210515186,"Flexential Nashville - Cool Springs, 425, Duke Drive, Franklin, Williamson County, Middle Tennessee, Tennessee, 37067, United States",building,yes,35.95102,-86.83342994
Consolidated Communications,400 Locust Street,50309,Des Moines,Iowa,USA,0,10075912836,"Ricochet, 400, Locust Street, Court District, Des Moines, Polk County, Iowa, 50309, United States",amenity,bar,41.5865534,-93.6223017
Peregrine Networks,27 Lowell Street,3101,Manchester,New Hampshire,USA,0,5574946,"27, Lowell Street, Manchester, Hillsborough County, New Hampshire, 03101, United States",place,house,42.99368145,-71.46141712
American Tower Corporation,325 17th Ave N,32250,Jacksonville Beach,Florida,USA,0,8649328301,"325, 17th Avenue North, Surf Park, Jacksonville Beach, Duval County, Florida, 32250, United States",place,house,30.3050382,-81.3959072
Microsoft,12901 W Olive Ave,85335,El Mirage,Arizona,USA,0,530253711,"12901, West Olive Avenue, El Mirage, Maricopa County, Arizona, 85335, United States",place,house,33.56548709,-112.3375524
Clarkson University,55 Main Street,13676,Potsdam,New York,USA,0,68167190,"55, Main Street, Village of Potsdam, Town of Potsdam, Saint Lawrence County, New York, 13676, United States",place,house,44.668737,-74.97892805
Amazon AWS,20945 Loudoun County Pkwy,20147,Ashburn,Virginia,USA,0,50187569,"Loudoun County Parkway, Ashburn, Loudoun County, Virginia, 20174, United States",highway,primary,38.9973773,-77.4786524
Cologix,1205 Technology Parkway,50613,Cedar Falls,Iowa,USA,0,15825117,"Technology Parkway, Cedar Falls, Black Hawk County, Iowa, 52613, United States",highway,unclassified,42.4726017,-92.4598969
H5 Data Centers,211 Commerce St,37201,Nashville,Tennessee,USA,0,19483193,"211, Commerce Street, Hopewell, Nashville-Davidson, Davidson County, Middle Tennessee, Tennessee, 37138, United States",place,house,36.22419813,-86.62876829
Digital Realty,1210 Integrity Drive,75081,Richardson,Texas,USA,0,597876730,"Digital Realty Dallas DFW18, 1210, Integrity Drive, Digital Realty, Richardson, Dallas County, Texas, 75081, United States",building,data_center,32.965124,-96.71259896
Ark Data Centers,5055 Rec Dr,52302,Marion,Iowa,USA,0,121486377,"REC Drive, Marion, Linn County, Iowa, 52302, United States",highway,residential,42.0538296,-91.5519953
Lumen,2001 Park Place North,35203,Birmingham,Alabama,USA,0,7783102,"2001, Park Place, Fourth Avenue Historic District, Birmingham, Jefferson County, Alabama, 35203, United States",place,house,33.519641,-86.80970043
QTS Data Centers,9340 Godwin Drive,20110,Manassas,Virginia,USA,0,217393320,"Godwin Drive, Manassas, Virginia, 20109, United States",highway,primary,38.751781,-77.508964
Cologix,1950 North Stemmons Freeway,75207,Dallas,Texas,USA,0,28544618,"Equinix Infomart, 1950, North Stemmons Freeway, Dallas, Dallas County, Texas, 75207, United States",building,yes,32.80096595,-96.819523
bigbyte.cc,123 CENTRAl Ave. NW,87102,Albuquerque,New Mexico,USA,0,439917785,"123, Central Avenue Northwest, Martineztown-Santa Barbara, Downtown Albuquerque, Albuquerque, Bernalillo County, New Mexico, 87102, United States",building,yes,35.0845334,-106.6489579
Impulse Advanced Communications,104 West Anapamu Street,93101,Santa Barbara,California,USA,0,243607539,"La Torre Building, 104, West Anapamu Street, Santa Barbara, Santa Barbara County, California, 93101, United States",building,yes,34.42215045,-119.70603
"NaviSite, Inc.",400 Minuteman Road,1810,Andover,Massachusetts,USA,0,60910705,"WSI Corporation, 400, Minuteman Road, North Andover, Essex County, Massachusetts, 01810, United States",building,yes,42.6966337,-71.21111095
Massive Networks,382 S. Arthur Ave,80027,Louisville,Colorado,USA,0,164988288,"382, South Arthur Avenue, Colorado Tech Center, Louisville, Boulder County, Colorado, 80027, United States",building,yes,39.96551885,-105.1243262
"UnitedLayer, Inc.",624 S Grand Ave,90017,Los Angeles,California,USA,0,428021816,"One Wilshire, 624, South Grand Avenue, Jewelry District, Downtown, Los Angeles, Los Angeles County, California, 90017, United States",building,commercial,34.0478871,-118.2555541
365 Data Centers,1500 Spring Garden St,19130,Philadelphia,Pennsylvania,USA,0,2573865972,"Dunkin', 1500, Spring Garden Street, Center City, Philadelphia, Philadelphia County, Pennsylvania, 19130, United States",amenity,fast_food,39.9625073,-75.163903
Gotspace Data Partners,Bozrah St,6334,Bozrah,Connecticut,USA,0,1079147273,"Bozrah Street, Fitchville, Bozrah, Southeastern Connecticut Planning Region, Connecticut, 06334, United States",highway,secondary,41.5589705,-72.1629498
Raeden,200 SE 1st St,33131,Miami,Florida,USA,0,6085440629,"200, Southeast 1st Street, Torch of Friendship, Miami, Miami-Dade County, Florida, 33131, United States",place,house,25.7733112,-80.1900581
Microsoft,875 Urban Industrial Wy,98802,East Wenatchee,Washington,USA,0,11873349640,"875, Urban Industrial Way, Microsoft East Wenatchee, East Wenatchee, Douglas County, Washington, 98802, United States",place,house,47.4176757,-120.2102717
DataNovaX,2236 Airport Dr,76306,Wichita Falls,Texas,USA,0,747985149,"ResultsCX, 2236, Airport Drive, Wichita Falls, Wichita County, Texas, 76306, United States",office,telecommunication,33.95328195,-98.52471515
Flexential,333 South 520 West,84042,Lindon,Utah,USA,0,32077617,"Canopy I, 333, South 520 West, Lindon, Utah County, Utah, 84042, United States",building,office,40.33261165,-111.7280366
Peace Communications,1661 Murfreesboro Road,37217,Nashville,Tennessee,USA,0,283638747,"1661, Old Murfreesboro Road, Una, Nashville-Davidson, Davidson County, Middle Tennessee, Tennessee, 37217, United States",place,house,36.10341669,-86.6662451
MegaNet Communications,275 Promenade St,2908,Providence,Rhode Island,USA,0,19377102,"275, Promenade Street, Downtown, Providence, Providence County, Rhode Island, 02908, United States",place,house,41.82886107,-71.42093339
ISG Technology,3700 W. May,67213,Wichita,Kansas,USA,0,13271253,"3700, West May Street, Wichita, Sedgwick County, Kansas, 67213, United States",place,house,37.659366,-97.385654
Gotspace Data Partners,334 Plain Hill Rd,6360,Norwich,Connecticut,USA,0,1030829674,"334, Plain Hill Road, Bean Hill Historic District, Bean Hill, Norwich, Southeastern Connecticut Planning Region, Connecticut, 06360, United States",building,yes,41.58388245,-72.1034326
ColoHouse,2401 Locust Street,19103,Philadelphia,Pennsylvania,USA,0,335293062,"2401, Locust Street, Rittenhouse Square, Center City, Philadelphia, Philadelphia County, Pennsylvania, 19103, United States",building,service,39.95035505,-75.18000723
Clear Rate Communications,62 Michigan Ave E,49017,Battle Creek,Michigan,USA,0,677864283,"JPG Resources, 62, East Michigan Avenue, Battle Creek, Calhoun County, Michigan, 49017, United States",office,company,42.3172945,-85.18108156
DataBank,1 Summer Street,2110,Boston,Massachusetts,USA,0,4074813873,"Dunkin', 1, Summer Street, Leather District, Downtown Boston, Boston, Suffolk County, Massachusetts, 02210, United States",amenity,fast_food,42.3518246,-71.0549596
Lumen,608 W. Adams Street,32204,Jacksonville,Florida,USA,0,8674622883,"608, West Adams Street, LaVilla, Brooklyn, Jacksonville, Duval County, Florida, 32204, United States",place,house,30.3290587,-81.6652413
Unknown Company,4003 East Speedway Boulevard,85712,Tucson,Arizona,USA,0,636026247,"4003, East Speedway Boulevard, Tucson, Pima County, Arizona, 85712, United States",place,house,32.23625405,-110.9073869
Digital Realty,904 Quality Way,75081,Richardson,Texas,USA,0,597876723,"904, Quality Way, Digital Realty, Richardson, Dallas County, Texas, 75081, United States",building,data_center,32.96621585,-96.71116973
PowerHouse Data Centers,21529 Beaumeade Circle,20147,Ashburn,Virginia,USA,0,1038916843,"Beaumeade Circle, Ashburn, Loudoun County, Virginia, 20147, United States",highway,unclassified,39.0144197,-77.4527053
Stream Data Centers,2080 Lunt Avenue,60007,Elk Grove Village,Illinois,USA,0,863162825,"Stream Chicago I, 2080, Lunt Avenue, Elk Grove Village, Elk Grove Township, Cook County, Illinois, 60007, United States",building,warehouse,42.00257805,-87.95110998
NewBridge,927 McDonald Ave,11218,Brooklyn,New York,USA,0,343386660,"927, McDonald Avenue, Parkville, Brooklyn, Kings County, City of New York, New York, 11218, United States",place,house,40.63187192,-73.97726708
Lumen,254 Granada Drive,93401,San Luis Obispo,California,USA,0,10569401,"254, Granada Drive, San Luis Obispo, San Luis Obispo County, California, 93401, United States",place,house,35.251209,-120.6672938
"DataPoint, Inc.",4901 Colt Road,61109,Rockford,Illinois,USA,0,22078981,"4901, Colt Road, Rockford, Cherry Valley Township, Winnebago County, Illinois, 61109, United States",place,house,42.22571222,-89.02106855
EdgeConneX,475 NE 185th St,33179,Miami Gardens,Florida,USA,0,11165349,"Northwest 185th Street, Scott Lake, Miami Gardens, Miami-Dade County, Florida, 33056, United States",highway,residential,25.9429694,-80.2333456
"FullControl Network, Inc",14400 College Blvd,66215,Lenexa,Kansas,USA,0,1110280229,"14400, College Boulevard, Lenexa, Johnson County, Kansas, 66215, United States",place,house,38.92744953,-94.75109884
ColoCSX,6425 Southpoint Parkway,32216,Jacksonville,Florida,USA,0,8681732285,"6425, Southpoint Parkway, Greenfield Manor, Jacksonville, Duval County, Florida, 32216, United States",place,house,30.2616878,-81.6010993
Lumen,5500 Feltl Rd,55343,Minnetonka,Minnesota,USA,0,6031324,"5500, Feltl Road, Minnetonka, Hennepin County, Minnesota, 55343, United States",place,house,44.90467946,-93.4206253
Digital Realty,1525 Comstock Street,95054,Santa Clara,California,USA,0,209073653,"1525 Comstock Street, 1525, Comstock Street, Santa Clara, Santa Clara County, California, 95054, United States",building,data_center,37.37488095,-121.9559991
CoreSite,1656 McCarthy Blvd,95035,Milpitas,California,USA,0,299388896,"CoreSite SV2, 1656, McCarthy Boulevard, Milpitas, Santa Clara County, California, 95035, United States",building,yes,37.405683,-121.9162603
STL,501 S. Towanda Barnes Rd,61705,Bloomington,Illinois,USA,0,934819198,"South Towanda Barnes Road, Bloomington, McLean County, Illinois, 61704, United States",highway,primary,40.4532238,-88.9017894
Verizon Communications Inc.,21555 Melrose Ave,48075,Southfield,Michigan,USA,0,377585069,"21555, Melrose Avenue, Southfield, Oakland County, Michigan, 48075, United States",place,house,42.44778881,-83.25538415
"Adtaq Internet, LLC",1420 NW Gilman Blvd. #231,69802,Issaquah,Washington,USA,0,4341972777,"Frankie’s Pizza - Issaquah, 1420, Northwest Gilman Boulevard, Issaquah, King County, Washington, 98129, United States",amenity,restaurant,47.5461289,-122.0581524
InfoBunker,3101 Ingersoll Ave,50312,Des Moines,Iowa,USA,0,155923336,"Buyers Realty, 3101, Ingersoll Avenue, Arbor Peaks, Des Moines, Polk County, Iowa, 50312, United States",office,estate_agent,41.5864295,-93.6595744
Equinix,111 8th Avenue,10011,New York,New York,USA,0,2601893113,"Google, 111, 8th Avenue, Manhattan Community Board 4, Manhattan, New York County, City of New York, New York, 10011, United States",office,company,40.7417176,-74.0041592
OneNeck IT Solutions,1655 W Sunrise Blvd,85233,Gilbert,Arizona,USA,0,820103326,"OneNeck IT Solutions, 1655, West Sunrise Boulevard, Sunrise Business Park, Gilbert, Maricopa County, Arizona, 85233, United States",office,it,33.3551689,-111.8268401
"Zone5, LLC",2415 Almeda Ave,23513,Norfolk,Virginia,USA,0,407211160,"2415, Almeda Avenue, Lansdale, Fox Hall Park, Norfolk, Virginia, 23513, United States",building,commercial,36.87806715,-76.21602124
Tract,W Lower Buckeye Rd,85338,Buckeye,Arizona,USA,0,589089718,"West Lower Buckeye Road, Buckeye, Maricopa County, Arizona, United States",highway,track,33.4211328,-112.7167627
Constant Hosting,101 Possumtown Rd,8854,Piscataway,New Jersey,USA,0,362662493,"QTS Piscataway, 101, Possumtown Road, Possumtown, Piscataway Township, Middlesex County, New Jersey, 08854, United States",building,data_center,40.5574623,-74.48445497
