NAME,ADDRESS,ZIPCODE,CITY,STATE,COUNTRY,result_num,osm_id,display_na,category,type,lat,long
Evocative Data Centers,480 N Bedford Rd,10514,Chappaqua,New York,USA,0,8805873836,"Building 600N, 480, Bedford Road, Chappaqua, Town of New Castle, Westchester County, New York, 10514, United States",place,house,41.1774816,-73.7512709
QTS Data Centers,6351 Longhorn Drive,75063,Irving,Texas,USA,0,9983085,"6351, Longhorn Drive, Irving, Dallas County, Texas, 75063, United States",place,house,32.89466316,-96.98029314
Centersquare,2681 Kelvin Ave,92614,Irvine,California,USA,0,504259521,"2681, Kelvin Avenue, Irvine Business Complex, Irvine, Orange County, California, 92614, United States",building,commercial,33.6847703,-117.8366956
ExcalTech,3618 8th Ave,53140,Kenosha,Wisconsin,USA,0,21498681,"3618, 8th Avenue, Grant, Kenosha, Kenosha County, Wisconsin, 53140, United States",place,house,42.60616547,-87.82167142
CoreSite,2950 Stender Way,95054,Santa Clara,California,USA,0,25356245,"2950, Stender Way, Santa Clara, Santa Clara County, California, 95054, United States",place,house,37.37556509,-121.970277
Centersquare,580 Winter St,2451,Waltham,Massachusetts,USA,0,896952355,"580, Winter Street, Prospectville, Waltham, Middlesex County, Massachusetts, 02451, United States",place,house,42.39709207,-71.26718514
Windstream,701 W Henry Street,46225,Indianapolis,Indiana,USA,0,10284097181,"701, West Henry Street, Old Southside, Indianapolis, Marion County, Indiana, 46225, United States",place,house,39.7595371,-86.1709558
"InterServer, Inc",110 Meadowlands PKWY,7094,Secaucus,New Jersey,USA,0,55316742,"110, Meadowlands Parkway, Harmon Cove, Secaucus, Hudson County, New Jersey, 07094, United States",place,house,40.78121855,-74.07841251
CloudHQ,44621 Waxpool Rd,20147,Ashburn,Virginia,USA,0,601391687,"44621, Waxpool Road, Ashburn, Loudoun County, Virginia, 20147, United States",place,house,39.01381403,-77.46354856
Data Stream LLC,141 West Jackson,60604,Chicago,Illinois,USA,0,9613380876,"Lamber Goodnow Injury Lawyers Chicago, 141, West Jackson Boulevard, Printer's Row, Loop, Chicago, Cook County, Illinois, 60604, United States",office,lawyer,41.8778832,-87.6323243
Digital Realty,2260 East El Segundo Boulevard,90245,El Segundo,California,USA,0,424945852,"DRT LAX12, 2260, East El Segundo Boulevard, El Segundo, California, 90245, United States",building,data_center,33.915514,-118.3846185
NJFX,1410 Wall Church Rd,7719,Wall,New Jersey,USA,0,60244117,"1410, Wall Church Road, Osbornes Mills, Wall Township, Monmouth County, New Jersey, 07719, United States",place,house,40.16004143,-74.05250204
Digital Realty,731 East Trade Street,28202,Charlotte,North Carolina,USA,0,886387747,"East Trade Street, Uptown, Charlotte, Mecklenburg County, North Carolina, 28202, United States",highway,primary,35.2240795,-80.8394104
CoreSite,2115 NW 22nd Street,33142,Miami,Florida,USA,0,435531451,"2115, Northwest 22nd Street, Miami, Miami-Dade County, Florida, 33142, United States",building,yes,25.7975443,-80.2300338
EdgeConneX,4916 E Broadway,53716,Madison,Wisconsin,USA,0,129453782,"4916, East Broadway, Madison, Town of Pleasant Springs, Dane County, Wisconsin, 53716, United States",place,house,43.04810594,-89.29828289
Verizon Communications Inc.,5127 Truse Rd,38117,Memphis,Tennessee,USA,0,19628425,"5127, Truse Road, Memphis, Shelby County, West Tennessee, Tennessee, 38117, United States",place,house,35.10887588,-89.89250625
Binary Net,134 S. 13th St.,68508,Lincoln,Nebraska,USA,0,14145418,"134, South 13th Street, Downtown, Original Lincoln, Lincoln, Lancaster County, Nebraska, 68508, United States",place,house,40.81316792,-96.70249408
Serverfarm,4949 Randolph Rd NE,98837,Moses Lake,Washington,USA,0,449177497,"Randolph Road Northeast, Moses Lake, Grant County, Washington, 98835, United States",highway,tertiary,47.190812,-119.2951056
ColoCrossing,3004 Irving Blvd,75247,Dallas,Texas,USA,0,858032454,"3004, West Irving Boulevard, Irving, Dallas County, Texas, 75061, United States",place,house,32.83276134,-96.98748622
DataBank,8375 Dominion Pkwy,75024,Plano,Texas,USA,0,1083806878,"Dominion Parkway, Plano, Collin County, Texas, 75024, United States",highway,tertiary,33.078736,-96.8022483
CROWN CASTLE,401 N. Broad Street,19108,Philadelphia,Pennsylvania,USA,0,334264478,"Terminal Commerce Building, 401, North Broad Street, Center City, Philadelphia, Philadelphia County, Pennsylvania, 19103, United States",building,yes,39.9598694,-75.16081442
Digital Realty,250 Williams Street NW,30303,Atlanta,Georgia,USA,0,630696901,"250, Williams Street Northwest, Hotel District, Atlanta, Fulton County, Georgia, 30308, United States",place,house,33.76163914,-84.39064994
Lumen,1220 L Street NW,20005,Washington,District of Columbia,USA,0,4134255300,"Shred Nations, 1220, L Street Northwest, Downtown, Ward 2, Washington, District of Columbia, 20005, United States",office,company,38.9033399,-77.0290413
Lumen,511 11th Avenue South,55415,Minneapolis,Minnesota,USA,0,63619642,"Minnesota Gateway Data Center, 511, 11th Avenue South, Minneapolis, Hennepin County, Minnesota, 55415, United States",building,yes,44.97112695,-93.25461666
C Spire,6184 US Hwy 98,39402,Hattiesburg,Mississippi,USA,0,545557883,"Lance Corporal Roy M Wheat Memorial Highway, Hattiesburg, Forrest County, Mississippi, United States",highway,motorway,31.2501953,-89.3304347
Switch,5225 W. Capovilla Ave,89118,Las Vegas,Nevada,USA,0,14314351,"West Capovilla Avenue, Enterprise, Clark County, Nevada, 89118, United States",highway,residential,36.0590131,-115.1948
Data Foundry,7401 East Ben White Blvd.,78741,Austin,Texas,USA,0,379204097,"7401, East Ben White Boulevard, Austin, Travis County, Texas, 78741, United States",building,yes,30.214974,-97.69497413
TulsaConnect,110 W. 7th St,74119,Tulsa,Oklahoma,USA,0,60965490,"Hillcrest Building, 110, West 7th Street, Oil Capital Historic District, Tulsa, Tulsa County, Oklahoma, 74119, United States",building,yes,36.1485791,-95.9906334
Iron Mountain Data Centers,2925 NW 120th Terrace,33167,Miami,Florida,USA,0,6037097337,"2925, Northwest 120th Terrace, Westview, Hialeah, Miami-Dade County, Florida, 33167, United States",place,house,25.8845422,-80.247101
Integris,205 2nd Street SW,55006,Braham,Minnesota,USA,0,118119015,"205, 2nd Street Southwest, Braham Mobile Home Park, Braham, Isanti County, Minnesota, 55006, United States",place,house,45.72411185,-93.17396047
Google,14706 Schram Rd,68138,Papillion,Nebraska,USA,0,14211332,"14706, Schram Road, Papillion, Sarpy County, Nebraska, 68138, United States",place,house,41.13257763,-96.14445961
AT&T Inc.,444 NW 79th Ave,33126,Miami,Florida,USA,0,308847268,"444, Northwest 79th Avenue, Hialeah, Miami-Dade County, Florida, 33126, United States",building,commercial,25.7736485,-80.32540217
Prime Data Centers,1111 Comstock St,95054,Santa Clara,California,USA,0,47570552,"1111, Comstock Street, Santa Clara, Santa Clara County, California, 95054, United States",place,house,37.37470741,-121.952001
Prime Data Centers,4701 S Santa Fe Ave,90058,Vernon,California,USA,0,966499786,"South Santa Fe Avenue, Vernon, California, 90058, United States",highway,secondary,34.0141615,-118.2303388
FirST Light Fiber,310 Marlboro St,3431,Keene,New Hampshire,USA,0,71079619,"310, Marlboro Street, Keene, Cheshire County, New Hampshire, 03431, United States",place,house,42.92364872,-72.26453418
Vaultas,1101 N Market St,53202,Milwaukee,Wisconsin,USA,0,5714414623,"Milwaukee Symphony Orchestra, 1101, North Market Street, Juneautown, Downtown, Milwaukee, Milwaukee County, Wisconsin, 53202, United States",office,ngo,43.0449333,-87.9100784
Amazon AWS,10281 Tanner Way,20110,Manassas,Virginia,USA,0,958057048,"Tanner Way, Manassas, Prince William County, Virginia, 20110, United States",highway,unclassified,38.7381302,-77.5035909
Dynamic Quest,4821 Koger Blvd.,27407,Greensboro,North Carolina,USA,0,470309831,"4821, Koger Boulevard, Whispering Woods, Beechcroft, Greensboro, Guilford County, North Carolina, 27407, United States",building,yes,36.0497669,-79.88165404
Consolidated Communications,770 Elm St,3101,Manchester,New Hampshire,USA,0,1019398284,"Consolidated Communications, 770, Elm Street, Manchester, Hillsborough County, New Hampshire, 03101, United States",building,commercial,42.9890144,-71.46365473
Oso Grande Technologies,725 6th Street NW,87102,Albuquerque,New Mexico,USA,0,14413979,"725, 6th Street Northwest, Downtown Albuquerque, Albuquerque, Bernalillo County, New Mexico, 87102, United States",place,house,35.09180641,-106.6528148
TierPoint,500 Rutherford Avenue,2129,Boston,Massachusetts,USA,0,6500599676,"Indigo Ag, 500, Rutherford Avenue, Charlestown, Boston, Suffolk County, Massachusetts, 02129, United States",office,company,42.381769,-71.0730303
Meta,4500 Like Way,76177,Fort Worth,Texas,USA,0,12151446220,"4500, Like Way, Alliance Gateway North, Fort Worth, Tarrant County, Texas, 76262, United States",place,house,32.9844048,-97.2617581
Digital Fortress,511 SW 10th Ave.,97205,Portland,Oregon,USA,0,6380267104,"Pacific University Eye Clinic, 511, Southwest 10th Avenue, Downtown, Portland, Multnomah County, Oregon, 97205, United States",shop,optician,45.5211102,-122.6817286
The Globe Building,710 North Tucker Blvd,63101,St. Louis,Missouri,USA,0,10257988107,"Maxar, 710, North Tucker Boulevard, Downtown West, Saint Louis, Missouri, 63101, United States",office,company,38.6326172,-90.1959473
Cologix,535 Scherers Ct,43085,Columbus,Ohio,USA,0,21358587,"535, Scherers Court, Columbus, Sharon, Franklin County, Ohio, 43085, United States",place,house,40.1164761,-83.00216667
360 Technology Center Solutions,360 E. 22nd St.,60148,Lombard,Illinois,USA,0,186592505,"360, East 22nd Street, Highland Hills, Lombard, DuPage County, Illinois, 60148, United States",place,house,41.84581133,-88.00720071
Switch,5325 W. Capovilla Ave,89118,Las Vegas,Nevada,USA,0,14314351,"West Capovilla Avenue, Enterprise, Clark County, Nevada, 89118, United States",highway,residential,36.0590131,-115.1948
Lumen,300 Bent Street,2141,Cambridge,Massachusetts,USA,0,29806082,"300, Bent Street, Wellington-Harrington, East Cambridge, Cambridge, Middlesex County, Massachusetts, 02141, United States",building,warehouse,42.36734905,-71.08673631
Acceleration,2511 NW 41st Street,32606,Gainesville,Florida,USA,0,228319187,"2511, Northwest 41st Street, Thornebrooke, Gainesville, Alachua County, Florida, 32606, United States",place,house,29.67617768,-82.38654138
Equinix,1920 E Maple Ave,90245,El Segundo,California,USA,0,424945843,"1920, East Maple Avenue, El Segundo, California, 90245, United States",building,industrial,33.9263426,-118.3940556
Evocative Data Centers,534 Stockton Ave,95126,San Jose,California,USA,0,8994053092,"534, Stockton Avenue, College Park, Rose Garden, San Jose, Santa Clara County, California, 95126, United States",place,house,37.3385488,-121.910161
Lumen,1124 Hardy Rd,77020,Houston,Texas,USA,0,423137570,"West Hardy Road, Melrose Park, Houston, Harris County, Texas, 77022, United States",highway,secondary,29.8714204,-95.365877
Amazon AWS,7060 Wellington Rd,20109,Manassas,Virginia,USA,0,490997243,"Amazon IAD73, 7060, Wellington Road, Manassas, Prince William County, Virginia, 20109, United States",building,data_center,38.7779795,-77.55909918
Wowrack,12201 Tukwila International Blvd,98168,Tukwila,Washington,USA,0,3251588817,"Virpus Networks, 12201, Tukwila International Boulevard, Tukwila, King County, Washington, 98168, United States",office,it,47.4932599,-122.293826
QTS Data Centers,5805 Campbell Rd,29745,York,South Carolina,USA,0,12559537,"5805, Campbell Road, York County, South Carolina, 29745, United States",place,house,35.04439517,-81.10490223
Flexential,118 South 10th West,84104,Salt Lake City,Utah,USA,0,1121188409,"Flexential Salt Lake City - Fair Park, 118, 1000 West, Salt Lake City, Salt Lake County, Utah, 84104, United States",building,yes,40.76678345,-111.9202947
CROWN CASTLE,624 S Grand Ave,90017,Los Angeles,California,USA,0,428021816,"One Wilshire, 624, South Grand Avenue, Jewelry District, Downtown, Los Angeles, Los Angeles County, California, 90017, United States",building,commercial,34.0478871,-118.2555541
"Information and Communications Services, LLC",175 South Third Street,43215,Columbus,Ohio,USA,0,6048726281,"Tiano & Associates, LTD., 175, South Third Street, Downtown, Columbus, Franklin County, Ohio, 43215, United States",office,company,39.9588196,-82.9976186
Earthnet,4735 Walnut St,80301,Boulder,Colorado,USA,0,200861400,"4735, Walnut Street, Boulder, Boulder County, Colorado, 80301, United States",building,office,40.01979395,-105.2419946
Amazon AWS,11800 Brewers Spring Rd,20109,Manassas,Virginia,USA,0,460060341,"Amazon IAD52, 11800, Brewers Spring Road, Manassas, Prince William County, Virginia, 20109, United States",building,data_center,38.79106485,-77.54838632
Google,4581 Webb St,74361,Pryor,Oklahoma,USA,0,309666504,"4581, Webb Street, Mid-America Industrial Park, Lusta, Pryor Creek, Mayes County, Oklahoma, 74361, United States",building,yes,36.24117205,-95.33004728
Centersquare,587 James S. McDonnell Blvd,63042,Hazelwood,Missouri,USA,0,595533247,"587, James S McDonnell Boulevard, Robertson, Hazelwood, Saint Louis County, Missouri, 63042, United States",place,house,38.772035,-90.381426
Lumen,214 E Ramsey Rd,78216,San Antonio,Texas,USA,0,15166085,"214, East Ramsey Road, San Antonio, Bexar County, Texas, 78216, United States",place,house,29.52812132,-98.4924873
CyrusOne Data Centers,9999 Westover Hills Blvd,78251,San Antonio,Texas,USA,0,509611432,"San Antonio Data Center I, 9999, Westover Hills Boulevard, Westover Hills, San Antonio, Bexar County, Texas, 78251, United States",building,data_center,29.46662675,-98.68815257
Delimiter Corp,500 Commack Road,NY 11725,Commack,New York,USA,0,83378897,"500, Commack Road, Commack, Town of Smithtown, Suffolk County, New York, 11725, United States",building,warehouse,40.82205365,-73.29188852
Equinix,2970 Corvin Drive,95051,Santa Clara,California,USA,0,8962114,"2970, Corvin Drive, Lawrence, Santa Clara, Santa Clara County, California, 95051, United States",place,house,37.37533396,-121.9879547
Flexential,3330 E Lone Mountain Rd,89081,North Las Vegas,Nevada,USA,0,746278786,"Flexential Las Vegas - North, 3330, East Lone Mountain Road, North Las Vegas, Clark County, Nevada, 89081, United States",building,yes,36.24816195,-115.1012544
Digital Realty,21745 Sir Timothy Dr,20147,Ashburn,Virginia,USA,0,649365764,"Digital Realty ACC9, 21745, Sir Timothy Drive, Ashburn, Loudoun County, Virginia, 20174, United States",building,data_center,39.0154586,-77.46715624
Lancium,1753 US Hwy 285,79735,Fort Stockton,Texas,USA,0,1019984833,"North US Highway 285, Fort Stockton, Pecos County, Texas, 79735, United States",highway,trunk,30.9007874,-102.9089992
ColoHouse,725 S Wells Street,60607,Chicago,Illinois,USA,0,148788289,"725-729, South Wells Street, Printer's Row, Loop, Chicago, Cook County, Illinois, 60607, United States",building,office,41.87262895,-87.63329793
Lockstep Technology Group,6867 Bluebonnet Blvd.,70810,Baton Rouge,Louisiana,USA,0,175481559,"6867, Bluebonnet Boulevard, Baton Rouge, East Baton Rouge Parish, Louisiana, 70810, United States",place,house,30.38884208,-91.09255882
Downtown Colo Corporation,624 South Grand Avenue,90017,Los Angeles,California,USA,0,428021816,"One Wilshire, 624, South Grand Avenue, Jewelry District, Downtown, Los Angeles, Los Angeles County, California, 90017, United States",building,commercial,34.0478871,-118.2555541
Windstream,7945 Bond St,66214,Lenexa,Kansas,USA,0,13105435,"7945, Bond Street, Lenexa, Johnson County, Kansas, 66214, United States",place,house,38.98470242,-94.71881193
ReliableSite,101 Possumtown Rd,8854,Piscataway,New Jersey,USA,0,362662493,"QTS Piscataway, 101, Possumtown Road, Possumtown, Piscataway Township, Middlesex County, New Jersey, 08854, United States",building,data_center,40.5574623,-74.48445497
LightEdge,9050 NE Underground Dr.,64161,Kansas City,Missouri,USA,0,18420468,"9050, Northeast Underground Drive, Hunt Midwest Business Center, Randolph, Kansas City, Clay County, Missouri, 64161, United States",place,house,39.1580121,-94.47459651
H5 Data Centers,505 Marquette Ave NW,87102,Albuquerque,New Mexico,USA,0,182298522,"Compass Bank Building, 505, Marquette Avenue Northwest, Downtown Albuquerque, Albuquerque, Bernalillo County, New Mexico, 87102, United States",building,office,35.0886842,-106.6526717
ColoHouse,36 NE 2nd Street,33132,Miami,Florida,USA,0,4761806199,"36, Northeast 2nd Street, Torch of Friendship, Miami, Miami-Dade County, Florida, 33132, United States",place,house,25.7758419,-80.1929625
Centersquare,9310 Florida Palm Dr.,33619,Tampa,Florida,USA,0,523886201,"Cyxtera Tampa TP1, 9310, Florida Palm Drive, Tampa, Hillsborough County, Florida, 33619, United States",building,yes,27.94553095,-82.35110077
Lumen,175 Harrier Drive,88088,Santa Teresa,New Mexico,USA,0,144814335,"175, Harrier Drive, Verde Santa Teresa Logistics Park, Strauss, Santa Teresa, Doña Ana County, New Mexico, 88008, United States",place,house,31.86674817,-106.6992177
QTS Data Centers,1275 Beech Rd SW,43054,New Albany,Ohio,USA,0,30169114,"1275, Beech Road Southwest, Beech, New Albany, Jersey Township, Licking County, Ohio, 43054, United States",place,house,40.06876381,-82.7541327
Digital Realty,365 South Randolphville Road,8854,Piscataway,New Jersey,USA,0,252069861,"365, South Randolphville Road, Newtown, Piscataway Township, Middlesex County, New Jersey, 08854, United States",place,house,40.5533448,-74.46062114
Jackson Technical,611 S Elgin Ave,74120,Tulsa,Oklahoma,USA,0,768028343,"Jackson Technical, 611, South Elgin Avenue, East Village, Tulsa, Tulsa County, Oklahoma, 74120, United States",office,it,36.1518687,-95.9842205
Equinix,7 Great Oaks Boulevard,95119,San Jose,California,USA,0,600806974,"Equinix SV10, 7, Great Oaks Boulevard, San Jose, Santa Clara County, California, 95119, United States",building,data_center,37.24118895,-121.7847548
DataBank,1500 Champa Street,80202,Denver,Colorado,USA,0,103456139,"Social Security Administration, 1500, Champa Street, Central Business District, Denver, Colorado, 80202, United States",building,civic,39.7457646,-104.994421
Colliers International,60 Hudson Street,10013,New York,New York,USA,0,250052732,"60 Hudson Street, 60, Hudson Street, Tribeca, Manhattan, New York County, City of New York, New York, 10014, United States",building,yes,40.7176412,-74.00827524
Commercial Media Corp,1430 Joh Ave.,21227,Baltimore,Maryland,USA,0,3033302013,"1430, Joh Avenue, Violetville, Baltimore, Maryland, 21227, United States",place,house,39.2600659,-76.6711606
LOGIX FIBER NETWORKS,4635 Southwest Freeway,77027,Houston,Texas,USA,0,2801323389,"4635, Southwest Freeway, Greenway / Upper Kirby, Houston, Harris County, Texas, 77027, United States",place,house,29.729218,-95.453583
FirSTLight Fiber,359 Corporate Dr,3801,Portsmouth,New Hampshire,USA,0,320902714,"FirstLight, 359, Corporate Drive, Pease International Tradeport, Portsmouth, Rockingham County, New Hampshire, 03801, United States",office,telecommunication,43.07274255,-70.80276247
Digital Realty,950 E. Collins Boulevard,75081,Richardson,Texas,USA,0,597876722,"Digital Realty Dallas DFW29, 950, East Collins Boulevard, Richardson, Dallas County, Texas, 75081, United States",building,data_center,32.96732195,-96.71052802
TierPoint,4121 Perimeter Center Dr.,73112,Oklahoma City,Oklahoma,USA,0,117752324,"4121, Perimeter Center Drive, Oklahoma City, Oklahoma County, Oklahoma, 73112, United States",place,house,35.51251973,-97.59355122
Lumen,1601 Jones Street,76102,Fort Worth,Texas,USA,0,670103918,"1601, Jones Street, Downtown Fort Worth, Fort Worth, Tarrant County, Texas, 76102, United States",place,house,32.75178344,-97.32614748
Ark Data Centers,1215 E Pennsylvania St,85706,Tucson,Arizona,USA,0,16926514,"1215, East Pennsylvania Street, Tucson, Pima County, Arizona, 85714, United States",place,house,32.17187227,-110.9539203
TierPoint,1401 Russell St,21230,Baltimore,Maryland,USA,0,336387583,"Baltimore Technology Park, 1401, Russell Street, Sowebo, Baltimore, Maryland, 21230, United States",building,yes,39.2754558,-76.62550987
702 Communications,58103,Fargo,North Dakota,USA,,0,,"58103, Fargo, Cass County, North Dakota, United States",place,postcode,46.85880554,-96.8244423
Conscious Capital Data Center,3141 Data Dr,95670,Rancho Cordova,California,USA,0,483066066,"3141, Data Drive, Rancho Cordova, Sacramento County, California, 95670, United States",place,house,38.58755744,-121.2827768
Lumen,345 Courtland St NE,30308,Atlanta,Georgia,USA,0,1029547285,"345, Courtland Street Northeast, Hotel District, Old Fourth Ward, Atlanta, Fulton County, Georgia, 30308, United States",place,house,33.76504965,-84.38419457
"On-Ramp Indiana, Inc.",859 Conner street,46060,Noblesville,Indiana,USA,0,163509998,"859, East Conner Street, Downtown Noblesville, Noblesville, Hamilton County, Indiana, 46060, United States",place,house,40.04552141,-86.01402435
Edged Energy,3420 N Arlington Ave,64161,Kansas City,Missouri,USA,0,564451178,"3420, North Arlington Avenue, Minaville, Kansas City, Clay County, Missouri, 64161, United States",place,house,39.155737,-94.4619021
Lumen,111 E Capitol Street,39201,Jackson,Mississippi,USA,0,13598612,"111, East Capitol Street, Jackson, Hinds County, Mississippi, 39201, United States",place,house,32.30025754,-90.18815215
CyrusOne Data Centers,800 Cottontail Ln.,8873,Somerset,New Jersey,USA,0,11775258,"Cottontail Lane, Franklin Township, Somerset County, New Jersey, 08873, United States",highway,residential,40.550482,-74.54496
"XNet Information Systems, Inc.",3080 Ogden Ave,60532,Lisle,Illinois,USA,0,398956857,"3080, East Ogden Avenue, Lisle, DuPage County, Illinois, 60532, United States",building,commercial,41.7967738,-88.11255437
Hivelocity,50 NE 9th St,33132,Miami,Florida,USA,0,6085499304,"50, Northeast 9th Street, Miami, Miami-Dade County, Florida, 33132, United States",place,house,25.7825762,-80.1927703
DartPoints,7127 Florida Blvd,70806,Baton Rouge,Louisiana,USA,0,112574290,"7127, Florida Boulevard, Florida Plaza, Baton Rouge, East Baton Rouge Parish, Louisiana, 70806, United States",place,house,30.45144077,-91.11571335
Lumen,111 N. Segrave St,32114,Daytona Beach,Florida,USA,0,8641420536,"111, North Segrave Street, Daytona Beach, Volusia County, Florida, 32114, United States",place,house,29.2110235,-81.0242503
Colovore,3060 Raymond St,95054,Santa Clara,California,USA,0,8949050,"3060, Raymond Street, Santa Clara, Santa Clara County, California, 95054, United States",place,house,37.37739048,-121.9526049
Fusion Connect,422 W Appleway Ave.,83815,Coeur d'Alene,Idaho,USA,0,444496438,"422, West Appleway Avenue, Blackwell, Coeur d'Alene, Kootenai County, Idaho, 83814, United States",place,house,47.70066655,-116.7920874
Colocation America,108 Bank Street,6702,Waterbury,Connecticut,USA,0,657403397,"108, Bank Street, Exchange Place, Waterbury, Naugatuck Valley Planning Region, Connecticut, 06702, United States",place,house,41.55436598,-73.04107513
Pinnacle Technical Solutions,4300 1st Ave.,25143,Nitro,West Virginia,USA,0,823570395,"1st Avenue, Nitro, Putnam County, West Virginia, 25143, United States",highway,secondary,38.4427681,-81.8320951
STACK INFRASTRUCTURE,1301 Touhy Ave,60007,Elk Grove Village,Illinois,USA,0,40788949,"1301, Touhy Avenue, Elk Grove Village, Elk Grove Township, Cook County, Illinois, 60007, United States",place,house,42.00758274,-87.96685682
Prime Data Centers,2215 Martin Ave,95050,Santa Clara,California,USA,0,48113474,"2215, Martin Avenue, Santa Clara, Santa Clara County, California, 95050, United States",place,house,37.36779395,-121.963314
Evocative Data Centers,3690 Redondo Beach Avenue,90278,Redondo Beach,California,USA,0,398060673,"3690, Redondo Beach Avenue, Redondo Beach, California, 90278, United States",place,house,33.88949259,-118.3700446
"SimpleNET, Inc.",225 Broadway,92101,San Diego,California,USA,0,5825476901,"Dunkin', 225, Broadway, Marina, Banker's Hill, San Diego, California, 92101, United States",amenity,fast_food,32.7152694,-117.16229
"aspStation, Inc",4736 Penn Ave,15224,Pittsburgh,Pennsylvania,USA,0,572180041,"4736, Penn Avenue, Bloomfield, Pittsburgh, Allegheny County, Pennsylvania, 15224, United States",place,house,40.46558206,-79.9478055
CyrusOne Data Centers,14815 Omicron Dr,78245,San Antonio,Texas,USA,0,663646925,"Texas Research and Technology Foundation, 14785, Omicron Drive, San Antonio, Bexar County, Texas, 78245, United States",office,research,29.42012525,-98.78948809
Windstream,105 Westwood Pl,37027,Brentwood,Tennessee,USA,0,19755122,"105, Westwood Place, Iroquois Estates, Brentwood, Williamson County, Middle Tennessee, Tennessee, 37027, United States",place,house,36.03692846,-86.80561185
"Cogent Communications, Inc.",1750 W Penhall Way,92801,Anaheim,California,USA,0,1082794765,"1750, West Penhall Way, West Anaheim, Anaheim, Orange County, California, 92801, United States",building,yes,33.834767,-117.9451075
DataBank,300 West Lexington Street,21202,Baltimore,Maryland,USA,0,336380960,"One Market Center, 300, West Lexington Street, Chinatown, Downtown, Baltimore, Maryland, 21201, United States",building,yes,39.2917117,-76.62041936
"Cogent Communications, Inc.",1190 Allene Ave SW,30310,Atlanta,Georgia,USA,0,9268690,"1190, Allene Avenue Southwest, Capitol View, Atlanta, Fulton County, Georgia, 30310, United States",place,house,33.7223282,-84.4133554
Prime Data Centers,1231 Comstock St,95054,Santa Clara,California,USA,0,47570552,"1231, Comstock Street, Santa Clara, Santa Clara County, California, 95054, United States",place,house,37.37468679,-121.9531257
Digital Realty,4025 Midway Rd,75007,Carrollton,Texas,USA,0,332435289,"4025, Midway Road, Carrollton, Denton County, Texas, 75007, United States",place,house,33.02136778,-96.843649
